index,title,genre,summary
14,The Black Prism,fantasy," The book is set in a world where colour is the foundation for all magic. Sixteen years after a war that rocked the world, the Prism receives a note from a lady named Lina, first telling him of the existence of and then telling him to come and get his now 15 year old son, a bastard child that had been conceived while he was betrothed to Karris White Oak, a member of the most elite bodyguard force, the Blackguard. The White sends Karris to Garriston, Tyrea's capital, to spy on its Satrap's army. She gives Karris a note informing her of Gavin's unfaithfulness, instructing her to not read it until after leaving the Chromeria (the center of magical learning). She sends Gavin to kill a color wight somewhere else, attempting to keep the two separated until well after Karris learned the news. However, Gavin chooses to bring Karris to Garriston himself before she can read the note, using a mode of transportation no one else even believes possible: magically-aided flight across the ocean. This allows them to enter Tyrea in hours, rather than the month or so expected otherwise. As they draw closer, Karris sees smoke, and directs them to the former town of Rekton, which has been burned to the ground. They are just in time to save a teenager from being executed, killing several of the Satrap's personal bodyguard in the process, at which point the Prism is confronted by the irate Satrap himself, self-styled King Garadul. He ordered the town to be wiped out as an example, due to their refusal to put up and pay levies. King Garadul plans to continue the march of his armies to Garriston. Due to Tyrea's role during the war, Tyreans are treated less respectfully, have no color representative on the council and have had their capital under a rotating occupation from the other Satrapies. Thus, Garadul considers himself king, not Satrap, and Garriston part of his land he intends to reclaim. The child is revealed to be none other than Gavin's bastard child, Kip. There follows some debate, which results in Kip and the Prism being allowed to leave together, though not without the exchange of several death threats. Before this occurs, however, the king takes a box from Kip which he claims was stolen from him. The box contains a white dagger given to Kip by his dying mother, who—through curses and abuse—made him promise to kill the man responsible. Away from all this, Karris reads the note given to her by the White, and is angered by Gavin's betrayal, his lies about it when breaking their engagement, and the White's attempts to manipulate her into forgiving him. Because of this, she ultimately refuses Gavin's offer of assistance the rest of the way to Garriston, opting to explore Rekton while Gavin brings Kip back to the Chromeria. She meets Corvan Danavis, Kip's tutor and a former general of Dazen Guile's army. She is eventually captured by king Garadul, while Corvan continues to Garriston. While Kip is entered into the Chromeria, shadowed by the Blackguard commander Ironfist, the Prism kills the color wight the White referred to. Before dying, the wight tells the Prism that Dazen should have won the war. Paranoid, Gavin returns quickly to the Chromeria to check on his brother, whom he has secretly imprisoned in a cell in which nothing but blue luxin can be drafted. It is then revealed that the Prism is in fact Dazen, having stolen his older brother Gavin's identity after the final battle of the war. When Dazen became Gavin after the war, he chose to break off Gavin's previous betrothal to Karis despite his own feelings, truthfully denying any affairs. Pressured by the White to teach a class of superviolets, the prism meets Aliviana Liv Danavis, Corvan's daughter and the only other person in the Chromeria from Rekton. Her tuition is paid by a sponsor from the Ruthgari Satrap, the sister of the current governor of Garriston. Her sponsor repeatedly blackmails her into spying on the Prism for Ruthgar, though her words and the lengths of cruelty she is willing to pursue to keep her hold suggest it is more a personal vendetta than any specific order. Knowing none of this, the Prism gives Liv official recognition of her bichrome nature (her second color was deemed too expensive to invest in by her contract-holder), in exchange for her teaching Kip the basics of drafting. While Kip and Liv catch up, the Prism meets with his father, Andross Guile, to speak about Tyrea. When he mentions the box Garadul took from Kip, Andross immediately asks if it is ""the white luxin,"" a supposedly mythical substance. His brother Gavin was aware of it as well, and Andross—not knowing Dazen isn't Gavin—assumes he knows what it is. Gavin can't ask, lest his disguise be discovered. Andross Guile orders his son to defeat Garadul's armies, but at all costs retrieve the dagger. Kip, Liv, the Prism and Ironfist leave for Tyrea to defend Garriston from Garadul's armies. Corvan reaches Garriston at about this time, and agrees to be Dazen's general again. Despite their friendship in reality, they must both pretend to hate and distrust each other deeply. Liv questions her father about it, but he refuses to tell her the truth. She assumes the Prism is blackmailing him with her life, and silently vows to make him pay. Liv and Kip run away to free Karris from Garadul's captivity. Ironfist leaves a few hours later, to see to their survival. Liv infiltrates successfully, while Kip is recognized and captured, though not before drafting sub-red for the first time. Karris, meanwhile, is taken to meet Lord Omnichrome, a color wight who heads Garadul's drafters. She recognizes him as her brother Koios, thought killed by Dazen in overzealous self-defense before the war. Ironfist helps Karris and Kip escape, and they both go after Garadul directly. Kip sees Lord Omnichrome give Zymun (a red drafter Kip knows from Rekton's burning) his mother's rosewood case, but Kip decides to help Karris. Playing on her disgust with the Prism and Chromeria, Omnichrome persuades Liv to join his cause in return for aiding Kip and Karris. Omnichrome intends for Garadul to die, so Corvan and Dazen try to save him. They are unsuccessful; Kip kills him in a rage before he can be stopped. Kip, Karris and Corvan retreat to the docks, along with the Prism. Kip saves Ironfist's life before chasing the ship that's already left the dock. As Kip runs across the water, he sees Zymun attempting to stab the Prism from behind with the white luxin dagger, and tackles him off the ship. He retrieves the box and leaves Zymun for the sharks before escaping with the Prism's ship. The Prism gives Kip the case, thinking the dagger lost. In it, Kip finds a note from his mother, telling him to kill the man who raped her, and that she loves him. Kip discovers that one of the clear diamond-like stones on the dagger's handle is now a sapphire-colored stone. At about this time, Gavin escapes from his blue luxin prison after nearly killing himself, only to find himself in an identical green luxin prison. The book ends as Dazen discovers that he can no longer draft blue."
15,Always Coming Home,fantasy," The book weaves around the story of a Kesh woman called Stone Telling, who lived for years with her father's people&mdash;the Dayao or Condor people, whose society is rigid, patriarchal, hierarchical and militarily expansionist. The story fills less than a third of the book, with the rest being a mixture of Kesh cultural lore (including poetry, prose of various kinds, mythos, rituals, and recipes), essays on Kesh culture, and the musings of the narrator, ""Pandora"". Some editions of the book were accompanied by a tape of Kesh music and poetry. Pandora describes the book as a protest against contemporary civilization, which the Kesh call ""the Sickness of Man"". Pandora muses that one key difference is that the Kesh have solved the problem of overpopulation—there are many fewer of them than there are of us. They use such inventions of civilization as writing, steel, guns, electricity, trains, and a computer network (see below). However, unlike most neighboring societies, they reject government, a non-laboring caste, expansion of population or territory, disbelief in what we consider supernatural, and human domination of the natural environment. They blend millennia of human economic culture by combining aspects of hunter-gatherer, agriculture, and industry, but reject cities; indeed, what they call towns would count as villages now."
16,Dragon Rider,fantasy," As the novel begins, a dragon clan receives word from a rat named Rosa that humans are going to flood their valley. In frightened disbelief, most of the dragons refuse to accept this news and decide to either hide, fight, or take flight to find safe refuge somewhere else. Slatebeard, the oldest and wisest dragon in the valley, tells the dragons of a great valley he once inhabited as a child, the Rim of Heaven. He believes this to be one of the last places on Earth for the dragons to hide from humans, and urges them to seek it. Firedrake alone heeds Slatebeard's message and sets off with Sorrel, his brownie companion, to find it, but not before Slatebeard warns him to ""beware the Golden One"". Rosa Graytail suggests before their departure that they should see her cousin, Gilbert Graytail, to pick up a map. They do so, but since Gilbert resides in a large city, Firedrake is forced to hide in an abandoned building. There they meet Ben, an orphaned human boy. Ben is astonished but not terrified by the dragon and quickly learns of his plan. He offers to aid Sorrel in her trek to the mapmaker's home. Though reluctant to be helped by one of her perceived enemies, Sorrel agrees and accepts the company of the boy. Sorrel reaches Gilbert's abode only to discover that he has been unable to, despite constant efforts, to locate the Rim of Heaven. He does mention that the pair's queries are similar to those of some mysterious ravens who visited him recently. Returning to the warehouse with a general world-map, Sorrel and Ben, who they decided must stay, gather up Firedrake and set out from the city. Becoming lost, they encounter a group of dwarves. One of them, named Gravelbeard, conveys news of the party's presence to Nettlebrand, a golden-scaled, draconoid occupying a nearby castle. Nettlebrand, whose only passion is hunting and killing weaker silver dragons, excitedly sets his armor-cleaner, a tiny ""homunculus"", called Twigleg to spy on Firedrake and his party in the hope that they will lead him to other dragons. Firedrake, Sorrel, and Ben fly onward, but are soon swept off course, arriving on the shore of Egypt. Encountering a basilisk and a band of zealous archaeologists, the party eventually befriends a kindly scientist named Professor Greenbloom. Sorrel is initially suspicious but soon warms up to him. Professor Greenbloom gives Ben one of two freezing-cold metallic scales, which unknown to the humans, once belonged to Nettlebrand. Twigleg relays the news to Nettlebrand, who immediately makes his way to the dig site to find Professor Greenbloom and recover the scales. Meanwhile, the three searchers set out on the advice of the professor to seek the advice of a Djinn, whose thousand eyes can see everything. Ben succeeds in fulfilling the Djinn's arcane requirements with the question: ""Where does the Rim of Heaven lie?"" The answer to the question appears in two of the Djinn's thousand eyes; it is a path, marked by the Indus River, by a mountain range, and by a monastery. Beyond this monastery is the Rim of Heaven. In the monastery, Ben must break the moonlight on the stone dragon's head. The Djinn also gives them a prophecy: ""When that day comes, twenty fingers will point the way to the Rim of Heaven, and silver will be worth more than gold."" Meanwhile, Nettlebrand tracks down Greenbloom, who manages to escape him. Twigleg is discovered but is allowed to stay due to his almost-perfect ability to understand and translate any language. He has been grown very attached to Ben, and he begins relaying false information to his master. While flying over the ocean, a lunar eclipse occurs and Firedrake (who lives off of moonlight), cannot fly. He falls and lands on the back of an initially frightening but amiable sea serpent. She agrees to take the friends to Pakistan, where they will rendezvous with a Dracologist, Zubeida Ghalib. She alone knows a way to help Firedrake fly without moonlight. Along the way, the Serpent tells them (among other things) about Nettlebrand and his army of red-eyed Ravens. As the peaceful voyage atop Serpent-back continues, they are spotted by one of Nettlebrand's raven spies. Annoyed, Sorrel throws a stone which she has smeared her adhesive saliva. The stone sticks to the Raven's wing and sends him panicking to shore. In Pakistan, the friends enter a village where Zubeida the Dracologist is living and also find Professor Greenbloom. His wife and daughter, Guinevere, have joined him on account of the incident with Nettlebrand. Deeply worried, the two parties compare their findings, which all point to a single grim fact—Nettlebrand is hunting the Dragons who live in the Rim of Heaven, and expects Firedrake to find them for him. Dr. Ghalib reveals a legend of a Dragon Rider who once lived in the village. Ben is his reincarnation, and his destiny is to save the silver dragons from a terrible enemy. No sooner have they heard the legend than two more of Nettlebrand's ravens descend on them. Sorrel attempts the saliva trick again, with one variation: a few sparks of Dragon-fire are added to the mix. The stones do not adhere, but the Ravens are indeed changed before the eyes of all, into a few crabs. This new strangeness on the part of Nettlebrand disturbs the searchers, ultimately inducing Twigleg to reveal his original intentions as Nettlebrand's spy. He also reveals Nettlebrand's origin—an alchemist created Nettlebrand as a dragon killing machine to obtain the Dragons' horns which he used in his experiments. Twigleg, and eleven other miniature men, were made as Nettlebrand's caretakers. When the Silver Dragons went into hiding, Nettlebrand killed the alchemist and eventually ate all of Twigleg's brothers, then went hunting on his own. Zubeida shows Firedrake and company not only the tomb of the original Dragon Rider, but also a species of flower which collects moonlight in the form of dewdrops on its leaves. Having drunk this ""moon-dew"", Firedrake is able to fly in the daytime. The two parties split up to lose Nettlebrand's pursuit in the mountains. After a hazardous encounter with a Roc, they are forced off course and must take refuge in a valley. Nettlebrand continues tailing a boat wherein are Professor Greenbloom and his family, knowing they will lead him to Firedrake, but is seen by Guinevere. In the valley, help comes to Firedrake and company in the form of Lola Graytail, Gilbert's niece. Lola had been cartographing the country for her uncle and she guides them to the monastery. There, they are welcomed by the monks, who look on Firedrake as a bringer of good fortune. Also it is here that Ben ""breaks the moonlight""--- actually a moonstone kept by the monks for this purpose. Ben shatters the moonstone and summons the aid of a four-armed brownie, named Burr-Burr-Chan. He agrees to guide Firedrake, Sorrel, Twigleg, and Ben to the Rim of Heaven. He warns, however, that Firedrake's kin have degenerated into earthbound cowards as a result of hiding from Nettlebrand. Whilst waiting for the moment of departure, the company discover Gravelbeard (who was threatened by Nettlebrand into becoming another spy) but fail to catch him. They fly on their way swiftly, with Nettlebrand in pursuit. To Twigleg's dismay, in the center of the Rim of Heaven is a great lake, a perfect gateway for Nettlebrand, who can travel by water. To make sure that he is right, Lola takes Twigleg in her miniature airplane to investigate and distract Nettlebrand, while above the others seek the Dragons' cave. There, they meet with a she-Dragon, Maia. She is the only living dragon there, as the other twenty-two have since turned into stone through lack of moonlight. Outside, Lola and Twigleg find Gravelbeard. In the struggle that follows, the Dwarf's hat (which functions as an altitude compensator), is taken by Twigleg. Promptly Gravelbeard is struck with mountain sickness, allowing himself to be taken a prisoner. Nettlebrand, who now knows their location, is coming. No one knows how they could ever stop him since he is twenty times as strong as one dragon as well as immune to other dragons' firepower. In disgust, Sorrel spits on the golden scale which the Professor gave to Ben. Inspired by his success with the Ravens, Firedrake breathes fire on it and reduces it to gold paint. Twigleg comes up with a plan. He frees Gravelbeard and sends him back to Nettlebrand. The Golden One, elated by upcoming success, orders the Dwarf to polish his armor. Unfortunately for Nettlebrand, the armor polish has been replaced with Brownie spit. Nettlebrand enters the cave, and is at once dive-bombed by Firedrake, Maia, and Lola in her plane. At last, the Dragons come together and set Nettlebrand afire. The Brownie spit reacts at once, dissolving Nettlebrand's armor and weakening him. He melts to reveal nothing but a toad underneath. As the company stare in wonder at this transformation, Gravelbeard enters. He has seen the marvelous gemstones and rock formations in the cave, and wishes to enhance them with his own skill, revealing that doing so will bring the petrified dragons back to life. Within a few days, all the silver dragons are awakened again. Firedrake and Maia fly with Sorrel and Burr-Burr-Chan to bring the other members of their species back home. Ben and Twigleg go to live with Professor Greenbloom and his family. Two months later, news reaches the humans that Firedrake has convinced the silver dragons to come with him to the Rim of Heaven. Eager to see their friends again, Ben and Guinevere occupy their time with other investigations of ""imaginary"" creatures until they can visit the silver dragons again."
17,Darkwalker on Moonshae,fantasy," The novel and its trilogy use the Moonshae Isles as its setting. Kazgoroth, the Beast, has come into the world to destroy the power of the Earthmother. Changing its shape as needs be, the Beast goes across the island of Gwynneth, corrupting everything in its way. Its destination is a large gathering of Northmen raiders at Oman's Isle, in the middle of the Moonshaes, where they are preparing an assault on the kingdom of Corwell. The Northmen don't realize yet that this is going to be more than just a plundering raid. They don't know that their leader isn't King Thelgaar Ironhand, but the Beast, who has killed the king and assumed his shape. Meanwhile, the Earthmother, aware of the danger and hurting from the corruption brought to the land, her body, by the vile presence of the Beast, awakes her children - the Leviathan, the Pack, and Kamerynn, the Unicorn. They will try to stop Kazgoroth in different ways, but that won't be enough. At Caer Corwell, the seat of the king of Corwell, rumour brings word of war coming to the kingdom. Preparation is under way, but the Ffolk don't know where the enemy will strike. It is up to Tristan to organize the Ffolk against this both human and demonic threat. In his fight against the odds, helped by Robyn, he will grow into the responsible leader that should inherit his father's kingdom."
18,Valiant : A Modern Tale of Faerie,fantasy," The book follows the life of runaway Valerie Russell in New York. Valerie is the child of a single mother and is quite tomboyish. At the start of the novel, Val attends high school, is a lacrosse player, and is best friends with the eccentric lesbian-identified Ruth. Val discovers her boyfriend, Tom, and her mother are having an affair. Betrayed and not sure where to go, Val runs away to New York City. She meets up with a group of teen-squatters, including Lolli (as in lollipop), Dave, and Luis. Val earns the nickname ""Prince Valiant"" after she helps a drag queen locate her shoe. This may be a homage to Hal Foster's comic strip, Prince Valiant or Prince Valiant in the Days of King Arthur. Though she earns the trust of the rest of the group, Luis remains wary of Val. She soon learns about the group's contact with a troll, Ravus. He lives beneath a bridge, a reference to the traditional fairy tale, The Three Billy Goats Gruff. Ravus also makes 'Never' that faeries in exile use so their bodies can be resistant towards iron. These exiles are dispersed throughout the city, and Dave and Luis must deliver the glamour to them. 'Never', according to the novel, can be used as a drug by humans. When used, humans are given magic for a short period of time. It's highly addictive; a comparison can be drawn between it and heroin. Lolli and Dave introduce Val to taking ""Nevermore,"" as they refer to it. Val, like the other squatters, is soon hooked. Ravus, despite Val's first impressions, is much kinder than he appears. He begins to teach her swordplay and the bond between them strengthens. Val's mounting problems and addiction take a nasty turn, and the trust Ravus has in her is threatened. Many of the Seelie court exiles are being poisoned. Ravus is blamed for the crime. When Ruth arrives, attempting to convince Val to come home, she refuses and Ruth insists she won't leave without Val. Val agrees to go home, but says she must say goodbye to Ravus before she leaves. She attempts to find him in his alcove, but he is not home, so she finds Ruth, Lolli and Luis by Belvedere Castle. Luis, all the while making sexual thenceforwards with Lolli very unexpectedly, informs her Dave has angrily stormed off, and they all fall asleep in a terrible state. In the middle of the night, Val awakes to see a tree-spirit faerie, who leads her to a festival by the water, where faeries and humans called ""sweet tooths"" run around freely. Ravus arrives, and delirious and half-starved, Val kisses him. He is pleased, until Mabry arrives as well, and when Val realized Mabry is the one who killed all the Fey. She tries to tell Ravus but Mabry cuts in, telling Ravus Val has been stealing his potions, and she flees as he becomes enraged. Ruth and Val go to find evidence of Mabry's murders, and they find a harp in which Mabry has strung the hair of those she's killed, including that of Tamson, Ravus' best friend and Mabry's ex-lover. When the hairs are plucked, they sing of their deaths, revealing that Mabry is responsible for Tamson's death and Ravus' exile. The girls also find Luis. The three of them come back to the other Luis and Lolli, and they realize that Dave is impersonating Luis, uncontrollably high off Never he got from Mabry after putting poison in Ravus' potions for her. Dave takes off his glamour, laughing, and falls unconscious. Ruth rushes him to the hospital as Lolli runs off, and Luis and Val rush to find Ravus so he can cure Dave. They find that Mabry has cut out Ravus' heart, and she runs off to the Unseelie Court with it. When she leaves, Val pulls back the curtains and turn Ravus to stone, and Val and Luis pursue Mabry into the Unseelie Court. She challenges Mabry to a first-blood duel for Ravus' heart with the glass sword belonging to Ravus, and after a moment's decision to never use Never again, she fights Mabry on talent alone, stabbing Mabry in the throat. She and Luis rush back to Ravus, and after placing his heart back into his chest, he instantly heals. Ravus gives Luis the tools to go heal his brother, and he and Val finally admit their love for one another. Eventually, Val decides to leave the streets and return home with Ruth. She and Ravus continually see one another, and Val says she plans to go to NY for college so she can see him. The two kiss, and Val is happy her life is back to normal, with the exception of having a faerie for a boyfriend and never being able to introduce him to her mother. Some fans have pointed out that Lolli, Dave and Luis are similar to Lutie-loo, Gristle and Spike from Tithe, respectively. Note: In the book Roiben and Kaye make appearances. Silarial and Nicnevin are referred to by Mabry."
