index,title,genre,summary
30,Dragon War,fantasy," The Boneless King captures Shimmer, Monkey, and Indigo. They manage to escape and attempt to retrieve Baldy's cauldron, in which Thorn's soul is now sealed. However the Boneless King turns the tables on them and traps them in an underground cavern beneath Egg Mountain where he was formerly imprisoned with the river poisoned and cavern sealed up. Indigo figures out that water is the exclusion to the barrier spell as the river can flow in, so transformed into ice versions of themselves, they are able to escape. Returning to the Boneless King's tomb disguised as soldiers, they find that he has finished his excavation and left. The three catch up to where the pack train is camped for the night, but are unable to bluff their way past the pickets and are forced to transform into horses. They discover that some of the guardsmen and horses have been poisoned from drinking the river water and that the pack train is transporting the stone soldiers that were found in the Boneless King's tomb. Still disguised, they accompany the pack train on its journey. On the way, mysterious gases emitted by the statues follow the pack train, arousing such resentment and fear from the population such that ""the countryside was almost ready to rise in rebellion"" by the time they reach the capital, Ramsgate. The pack train is nearly attacked by villagers at the capital's gates, but is saved by reinforcements. The statues are buried in a pit on the palace grounds. The three manage to follow the Boneless King disguised as guardsmen to the harbor and onto the flagship of his war fleet, necessitating a change in disguise to being sailors. Determining that Thorn is in the captain's cabin, they manage to convince the Boneless King's puppet wizard Horn to let them in, but rouse his suspicions and that of his massive white dog Snowgoose, who he had rescued from his island. Unable to retrieve Thorn in time, they transform into fleas and hide on Snowgoose's collar. Able to smell them but unable to determine where they are, Snowgoose gets so upset that the Boneless King loses patience with her and has her locked in a storeroom. They leave and return to the deck just as the fleet sets sail. Pomfret arrives after the fleet is underway to relay intelligence of the dragon army gathered at the Hundred Children, an archipelago formed from an undersea mountain chain. He also recognizes that the strange, deep sea creatures that suddenly attack the fleet are illusions cast by dragon mages, resulting in the Boneless King dispelling them. The fleet is confronted with a wall of fire as it nears the Hundred Children. As the Boneless King attempts to disperse it, Shimmer makes her move to rescue Thorn, but she and Monkey are captured. At that moment the dragon army advances towards the fleet despite counterattacks on the vanguard with a flammable liquid that can burn in water. As the Boneless King prepares to use the cauldron to boil the ocean, Shimmer and Monkey escape and leap into the sea. Along with Indigo in dragon form, they are chased by Pomfret and marines transformed into alligators. They are nearly captured while attempting to lose their pursuers within the caves of the Hundred Children which Shimmer played in when she was younger, but by using the buoyancy properties of the needleweed juice that Indigo has been carrying all this time, Pomfret and the marines are rendered helpless as they are carried to the surface. As they make their way towards the dragon army which has been forced to retreat and given 24 hours to surrender, Shimmer tries to convince Indigo to seek safety on the mainland. However Indigo adamantly refuses to go and vows to continue on with Shimmer, as Shimmer is “the only thing” she has ever loved given her rough existence, aided by Monkey’s suggestion that she may have a role in carrying out Civet’s prophecy. Catching up with the dragon army, on the way to Sambar’s palace they are met by badly injured members of Shimmer’s clan, who insist on escorting her. At the palace, Shimmer confronts her uncle, offering the dream pearl as temporary collateral for Baldy’s cauldron and better treatment of the Inland Sea dragons, and asking for help in rescuing Thorn. News is then received that the krakens have begun a large scale invasion, capturing the other forts and forges and forcing the Inland Sea dragons to flee. Sambar has a change of heart and vows to fight alongside Shimmer, who will direct the effort against the Boneless King while he handles the krakens. Indigo devises a plan to use the exotic creatures found in Sambar's larder to terrify the humans, enabling to her to exact some payback on the kitchen staff who formerly mistreated her and earning the respect of the Inland Sea dragons who help her out. After Shimmer's band of dragons is assembled, they receive intelligence on the Boneless King's dispositions from a mage named Bombax who spied on the humans in the form of a gull. It reveals that the Boneless King has erected a series of prefabricated forts on the Hundred Children, and that he is at one of the forts with Thorn and Pomfret. After Indigo observes that the defenses are oriented towards the east, Shimmer decides to use the dream pearl to cast an illusion augmented by the Grand Mage Storax's fog bank, while the other dragons hit the fleet from the west and Monkey rescues Thorn. When they are in position, Shimmer casts a great illusion of a dragon army approaching from the east, but the dream pearl physically drains her and nearly claims her life. Monkey is forced to destroy it to save her as Storax and his fellow mages create a fog illusion to mask that of the fake army. Monkey then infiltrates the fort where the Boneless King is and impersonates Pomfret, succeeding in getting the real Pomfret attacked by a second flame bird that the Boneless King had deployed. During its pursuit of Pomfret, this flame bird sails among the warships gathered in the channel, setting them ablaze and crippling the fleet. Monkey rescues Thorn just as the dragons begin their attack. They infiltrate the forts disguised as humans and disposing of the living fire bombs and sinking the remaining ships. He returns to the battle after leaving Thorn with Shimmer and Indigo, during which the unleashing of the exotic creatures of Sambar's larder on the forts proves the last straw for their garrisons, resulting in their surrenders. After it is over however, it turns out that Pomfret was able to steal Thorn back disguised as Monkey. Shimmer, still exhausted from using the dream pearl, along with Indigo and Monkey set off in pursuit. They catch up to Pomfret, who is transporting the Boneless King, Horn, and Snowgoose. He flies into Ramsgate, which has erupted in revolt, and is chased all the way to the palace. There, faced with a revolt of his own ministers, the Boneless King openly declares himself for who he is, offering greater rewards to Pomfret who throws his lot in with him. The Boneless King then unleashes the stone statues from his tomb that were buried in the palace grounds, which suddenly brought to life, begin to attack his enemies. Monkey uses clones of himself to distract them and get them to attack each other, just as the Smith and Snail Woman arrive and lend their assistance. Leaving them to deal with the statues, Monkey, Indigo and Shimmer to chase after the Boness King. Inside the palace, they realize that Thorn bears a striking resemblance to the last king before the Butcher, Emerald III, making him the crown prince. They confront the Boneless King in the throne room where they fall into an ambush, with Shimmer and Monkey getting bound with magical iron collars while Indigo is turned into a bronze statue. The Boneless King decides to send them all back to ""before there was time...back to when nothing had form or shape"", from which not even he himself could escape. While he casts the spell, Pomfret tries to convince Shimmer that he was right, based on the vision of him as the king of all the dragons that he as seen in the World Mirror, which was found in the Nameless One's tomb and reflects the possibilities that could have been and could be, but does not make predictions. With Monkey's help, Shimmer gets Pomfret to see that if the Boneless King rules the world, all possibilities are revealed to be a wasteland with no signs of life. As Pomfret has a change of heart, the Boneless King finishes summoning the portal to before time then turns on him and binds him. As he begins to have Shimmer dragged into the portal, Pomfret, realizing the magnitude of what he has done, with a final effort throws himself at the Boneless King, carrying them both into the portal chased by Snowgoose. The Boneless King's spells are dissipated, freeing Monkey and Shimmer and restoring Indigo. The news is broken to Lord Tower, the chancellor, that Thorn the crown prince is trapped in the cauldron. The Smith and the Snail Woman agree to help restore Thorn, taking a sample of one of the Boneless King's stone statues to study. The war between the dragons and humans over, Shimmer and her companions are later accompanied by the Inland Sea dragons and many humans from Ramsgate to River Glen, where the Inland Sea waters are boiled away with the cauldron. They then travel to the site of the Inland Sea, where its waters are poured out from the cauldron and restored. The Lord of the Flowers arrives and restores Ebony's tears, after which Indigo decides to join Shimmer's clan as she has lived among dragons for most of her life, being transformed into one by Storax. The Smith and the Snail Woman reappear with the news that they cannot fully restore Thorn to his human form, but can attempt to turn him into some form which will keep him as both part-cauldron and immortal, to which Thorn agrees, felt as a tingling when the cauldron is held. The Lord of the Flowers then reappears with Monkey's master, the wizard known as the Old Boy, who reveals that he left Thorn in the village of Amity as an infant. After he helps the Smith and the Snail Woman, Thorn is brought back in human form, but makes creaking sounds when he bends his joints. He is convinced to and agrees to assume the throne. Sambar later arrives following his victory over the krakens and bringing material aid and labor to help restore the Inland Sea. Disappointed that Thorn as the cauldron has been changed back, he accepts Thorn's pledge of friendship between the dragons and the humans. Monkey then departs the Inland Sea just before the arrival of the dragon King of the Golden Sea, from whom he had stolen his magical rod."
31,Emperor Mage,fantasy," Daine is sent with a delegation that includes both Sir Gareths of Naxen, Alanna the Lioness, and Numair Salmalin, to the Emperor Mage of Carthak, in hopes that she can smooth the international relations by helping with his prized birds. All seems well in the elaborate court of the charming emperor, who continues to proclaim his innocence in stirring up troubles in Tortall and seems to truly care for his prized aviary. This soothes the nervous delegation, though the situation is complicated by Numair, who had to flee Carthak and Ozorne's ire several years before. Daine makes several friends in Carthak, including Numair's former teacher and close friend Lindhall Reed, Ozorne's heir and nephew Kaddar, and a marmoset named Zekoi. She also is reunited with the Stormwing Rikash Moonsword, who seems to bear her no significant ill will and in fact warns her several times about the trouble brewing in the empire. Despite her best efforts, she gets caught up in not only the political situation, but a religious one as well. Emperor Ozorne Muhassin Tasikhe has been neglecting the worship of the gods, primarily the chief Goddess of Carthak, the Graveyard Hag. To Daine's surprise and later chagrin, she realizes that the Graveyard Hag has given her the ability to revive dead bodies, which leads to a series of mixed episodes which includes the revival of an only partly assembled Archaeopteryx skeleton and culminates in the revival of a whole nest of dinosaur eggs and nestlings. The reanimation of the nest results in Daine killing herself and having to get forcibly revived by the Badger god. During the time she is ""dead,"" she gets a brief image of her mother with a mysterious horned stranger. Daine fights her newly given ""gift,"" which cannot be taken away except by the Graveyard Hag, who has supreme power in Carthak as the primary goddess. It is noted that the only one more powerful in Carthak is the Black God, god of death, but she is his daughter and he listens to her in matters involving Carthak. The Graveyard Hag urges Daine, as her vessel, to act by causing chaos with the revival of the human dead to get Emperor Ozorne to remember the gods once more. Daine is understandably disinclined to do so. During her time healing the birds, Daine realizes that the birds illness is caused by metal paint that they are eating saying that it tastes good (it contains salt as well iron) When she tells this to Ozorne, he congratulates her and gives her a drug to make her sleep in her food. Meanwhile, the Tortallan party is planning to leave Carthak, but Numair will not leave his ""magelet"" behind. Daine is resccued from the dungeon by Zek, who is very fascinated by keys. She then meets up with Prince Kaddar. He tells her that Ozorne had Numair killed. Daine is overcome with fury. Using her power to revive dead beings to create an army out of the hall of bones. While looking for Ozorne, she meets with Numair's ex-lover. Daine tells her that Numair is dead. Daine finds the Hyenas and transforms into one. Using their excellent sense of smell, they hunt down Ozorne. They are about to attack him when he stabs himself with the Stormwing feather given to him by Rikash. Ozorne turns into a stormwing and flies away with the rest of them. Daine turns around to see Kaddar, Lindhall, and Numair. Losing her grip on her Hyena self, Daine transforms into her human, naked self. Nuamir gives her his robe and tells her that a Simulacrum of himself was caught and ""killed"" by Ozorne, not the real Numair. Then, the graveyard hag comes and takes the power of reviving the dead from Daine. Four days later, Daine wakes up to find Alanna at her side. She then goes to talk to His Imperial Highness, Kaddar. He tells Daine that she can have whatever she wants for saving his life (his uncle was planning to have him accused of treason of plotting against him). Daine asks that the people who have wild magic and the emperors mutes must be released from slavery. <!--"
32,Conan the Liberator,fantasy," Following the events of the story ""The Treasure of Tranicos"", Conan joins a conspiracy of former comrades-in-arms to overthrow Numedides, the mad and tyrannical king of Aquilonia. As commander of the rebel forces, he has the prospect of becoming king himself if they succeed, but he has not only Numedides' loyal troops, led by General Procas, to overcome, but the spells of the evil sorcerer Thulandra Thuu. Chronologically, Conan the Liberator overlaps the events of the story ""Wolves Beyond the Border"", and is followed by the story ""The Phoenix on the Sword""."
33,Vườn Thanh Xuân (The Garden Of Youth),bilingual,"Cuốn sách The Garden Of Youth - Vườn Thanh Xuân sẽ là những thông điệp, câu chuyện, Bài học sâu sắp song ngữ Anh - Việt giàu màu sắc và nhiều cung bậc cảm xúc, sẽ là món quà truyền đến bạn cảm hứng rèn luyện tiếng Anh, không ngừng nâng cấp, hoàn thiện bản thân ngày càng tốt đẹp hơn. Và xây dựng cho chính mình một khu vườn thanh xuân thật rực rỡ, thật muôn màu và thật đáng nhớ
Trích lời nói đầu trong cuốn sách.

- Các câu và đoạn trích dẫn song ngữ xen kẽ về bài học cuộc sống, câu chuyện tình yêu tuổi thanh xuân và khát vọng hoài bão tuổi trẻ. Truyền cảm hứng rèn luyện tiếng anh và nâng cấp hoàn thiện bản thân mỗi ngày trở nên tốt đẹp hơn.
- Từ vựng và ngữ pháp ở mức độ cơ bản, dễ đọc hiểu và ghi nhớ, giúp bạn tăng vốn từ vựng, ghi nhớ x3 và cải thiện tiếng anh dễ dàng hơn.
- Là món quà đồng hành và xây dựng tuổi thanh xuân của bạn thật rực rỡ và thật đáng nhớ!"
34,sayings Of Youth,bilingual," Các câu song ngữ Anh Việt (Bản không phải dạng xen kẽ, tiếng anh và tiếng việt tách biệt nhau) về tuổi thanh xuân, hoài bão tuổi trẻ và những bài học cuộc sống sâu sắc, giàu cảm xúc.
- Từ vựng và cấu trúc câu cơ bản, dễ đọc - dễ hiểu - dễ nhớ. Tạo cảm hứng học tiếng anh và ghi nhớ từ vựng dễ dàng hơn.
- Truyền cảm hứng sống hết mình với những ước mơ tuổi trẻ, rèn luyện nâng cấp bản thân mỗi ngày trở nên tốt đẹp hơn và xây dựng một tuổi thanh xuân nhiều màu sắc và thật đáng nhớ!"
35,CHA - Điểm Tựa Đời Con,emotional,"Cùng với cuốn sách Cha - Điểm tựa đời con , bạn sẽ cùng chúng tôi bước vào hành trình khám phá thế giới của những người cha. Trên hành trình này, bạn sẽ nhận ra những cung bậc tình cảm của cha và sẽ hiểu rõ hơn về trải nghiệm trong chính tình cảm cha con của mình.

Có thể nói, tình yêu thương cha dành cho con là tuyệt đối và vô song. Dù muốn hay không, mỗi bước đi trong cuộc đời mỗi người con chúng ta đều có sự hiện diện của hình bóng cha. Cha cho ta hình hài và nâng bước ta bằng đôi cánh của sự hy sinh thầm lặng. Cha cho ta lòng dũng cảm để đương đầu với mọi thử thách của cuộc sống. Cha cho ta sức mạnh để vững bước trên đường đời. Trên hết, cha cho ta niềm tin vào sự kỳ diệu của tình yêu thương và sự bao dung.

Nếu tình mẹ êm đềm và sâu lắng như sông thì tình cha lại cao cả và vững bền như núi. Xưa nay, tình mẹ luôn là đề tài bất tận của mọi cảm hứng nghệ thuật và thơ ca. Và vì quá để tâm đến tình mẹ mà dường như chúng ta đã đối xử “bất công” với tình cha. Cha lạnh lùng để ta khôn lớn; cha nghiêm khắc để ta nên người. Và đôi lúc, vì không có được sự quan tâm của cha như mong muốn nên ta quên rằng tận sâu trong trái tim cha, ta luôn là tuyệt đối.

Vì thế, nếu một ngày kia bạn vấp ngã trên đường đời, sự nghiệp phá sản, tình yêu đổ vỡ hay bị ai đó phản bội… thì hãy nghĩ về cha cùng những kỳ vọng mà người đã dành cho bạn. Hãy để cha trở thành niềm an ủi cho bạn trong những phút giây yếu lòng. Hãy tìm về với cha – dù bằng xương bằng thịt hay chỉ là trong ý nghĩ – để tin rằng dù thế nào chăng nữa cũng luôn có người yêu thương bạn bằng cả trái tim.

Với cuốn sách Cha - Điểm tựa đời con , chúng tôi muốn chia sẻ với các bạn những câu chuyện cảm động về tình cha, những câu chuyện gây xúc động bởi sự chân thật và những yêu thương vô bờ của tình cha con. Trong mọi hoàn cảnh và ở mọi thời điểm, cha vẫn luôn theo sát cuộc đời mỗi chúng ta, soi sáng lối ta đi bằng ánh sáng của tình yêu thương.

Qua đây, chúng tôi – những người thực hiện tập sách này – cũng xin được gửi lời tri ân đến người cha của mình. Tình yêu thương và sự chở che của cha là điểm tựa vững chắc suốt cuộc đời con!"
36,Mẹ trong tâm trí con,emotional,"Cuốn sách chứa đựng những khía cạnh đa chiều trong mối quan hệ mẹ con mà bình thường các con không thể hoặc khó thổ lộ với mẹ.

Qua đó, cuốn sách đã thể hiện được những tình cảm thiêng liêng, những khoảnh khắc cảm xúc không dễ lặp lại của các con dành cho mẹ, cùng sự tri ân tình cảm của các con đối với mẹ.

Trong cuốn sách một trong những đoạn thơ mình yêu thích nhất là:

“Chín tháng mang nặng đẻ đau

Mầm sống của mẹ sắc màu trần gian

Sinh con chẳng quản gian nan

Cho con cuộc sống nồng nàn yêu thương”

Dẫu biết rằng, trong mối quan hệ mẹ con không phải lúc nào cũng êm đềm, mà đôi khi trải qua vô vàn sóng gió, thăng trầm nhưng mẹ mãi ở bên làm động lực cho con vững bước trên đường đời. Con chính là món quà vô giá, là niềm tin, là niềm tự hào của mẹ. Mỗi tác phẩm là một câu chuyện, một lời tâm sự của tác giả mà biết đâu chúng ta lại bắt gặp hình ảnh của chính gia đình mình ở trong đó.

Một cuốn sách quá hay và giàu ý nghĩa nhân văn. Nhắc nhở chúng ta hãy biết yêu thương mẹ mình hơn. Các bạn hãy cùng tìm đọc cuốn sách này tại thư viện nhé! Phần giới thiệu sách của chúng mình đến đây là hết cảm ơn các bạn đã chú ý lắng nghe!"
37,Tư Duy Ngược,skills thinking,"Chúng ta thực sự có hạnh phúc không? Chúng ta có đang sống cuộc đời mình không? Chúng ta có dám dũng cảm chiến thắng mọi khuôn mẫu, định kiến, đi ngược đám đông để khẳng định bản sắc riêng của mình không?. Có bao giờ bạn tự hỏi như thế, rồi có câu trả lời cho chính mình?,Tư duy ngược - Nguyễn Anh Dũng

Tôi biết biết, không phải ai cũng đang sống cuộc đời của mình, không phải ai cũng dám vượt qua mọi lối mòn để sáng tạo và thành công… Dựa trên việc nghiên cứu, tìm hiểu, chắt lọc, tìm kiếm, ghi chép từ các câu chuyện trong đời sống, cũng như trải nghiệm của bản thân, tôi viết cuốn sách này.

Cuốn sách sẽ giải mã bạn là ai, bạn cần Tư duy ngược để thành công và hạnh phúc như thế nào và các phương pháp giúp bạn dũng cảm sống cuộc đời mà bạn muốn."
38,Tư Duy Mở,skills thinking,"Con người đang sống trong thời đại công nghệ, khi mọi thứ thay đổi chóng mặt, điều đó đòi hỏi chúng ta phải linh hoạt trong cách tư duy để bắt kịp xu hướng toàn cầu. Hay nói cách khác, chúng ta cần có một tư duy mở để đón nhận và khai phá kiến thức mới, bởi nếu chúng ta cứ khăng khăng giữ định kiến của mình thì sự phát triển sẽ đi vào ngõ cụt.
Cụ thể hơn, người có tư duy mở tin rằng chỉ cần họ nỗ lực, thay đổi là có thể tiến bộ hơn. Họ sẽ vui vẻ chấp nhận thử thách, xem thử thách như cơ hội để học hỏi được những điều hay cái mới. Khi đối mặt với khó khăn hay không thành công, người có tư duy mở thường có thái độ: “Cách này không hiệu quả, vậy mình thử cách khác”. Đối với họ, thất bại chỉ là bài học giúp họ hoàn hảo hơn trên con đường khẳng định bản thân và phát triển sự nghiệp.
Vậy làm thế nào để biết được chúng ta đang có loại tư duy nào, đóng hay mở? Và làm thế nào chúng ta nhận ra chúng?
Nhưng làm thế nào để có được tư duy mở?
Và tư duy mở góp phần vào cuộc sống của chúng ta thế nào?
Khi bạn đặt ra những câu hỏi đó thì cuốn sách này sinh ra để dành cho bạn. Cuốn sách được biên soạn dựa trên sự học tập và nghiên cứu tài liệu trong và ngoài nước cũng như từ những trải nghiệm của bản thân tác giả sẽ mang lại cho bạn những giá trị hữu ích của tư duy mở, giúp bạn tự tin chinh phục ước mơ, sẵn sàng đón nhận mọi chướng ngại và luôn nở nụ cười hạnh phúc."
39,Think And Grow Rich,skill,"Cơ hội đặc biệt đã đến với Hill trong một lần phỏng vấn để viết về chân dung Andrew Carnegie - ông 'vua thép' huyền thoại của Mỹ đã đi lên từ hai bàn tay trắng. Từ lần phỏng vấn đó, Napoleon Hill có dịp tiếp cận với những con người thành đạt và có quyền lực nhất tại Mỹ để tìm hiểu và học hỏi những bí quyết thành công của họ, trong thế so sánh và kiểm chứng với những công thức thành công của Andrew Carnegie. Ông muốn qua đó có thể đúc kết và viết nên một cuốn sách ghi lại những bí quyết giúp biến các cá nhân bình thường thành những người thành công trong xã hội."
40,21 Bài Học Cho Thế Kỷ 21 (Tái Bản),skill,"Với cách hiểu như vậy, có lẽ phải cần một ít thời gian nữa, để những ai ngày ngày theo dõi tin tức qua tivi và cả những nhà làm chính sách của các quốc gia 'đàn anh thế giới' đang thương lượng các khoản ngân sách để chi cho công cuộc chống khủng bố có thể đồng cảm và nhìn thấy từ đó một hướng ra bền vững hơn."
41,Tuổi Trẻ Đáng Giá Bao Nhiêu,skill,"Tuổi trẻ đáng giá bao nhiêu là quyển sách không nặng nề giáo điều, 
                    không chỉ trích cực đoan, đơn giản chỉ là những tâm sự bình dị của người đi trước"
