index,title,genre,summary
19,Yendi,fantasy," Six months after he took control of his own territory in the criminal Organization, Vlad engages in his first turf war with a rival boss. Each chapter's epigraph is a quote from its chapter. Vlad narrates this story from a point in his life before the events of Phoenix. He quickly summarizes the series of turf wars and assassinations that led him to rise in the ranks of the Organization from low-rung assassin to the boss of his own neighborhood. As the story begins, Vlad has held his territory for six uneventful months, but then he receives word that a neighboring boss, Laris, has started to move in on his territory. A turf war between Vlad and Laris erupts. Vlad receives indirect help from several of his powerful friends in the House of the Dragon, but remains one step behind the better-prepared and better-informed Laris. Vlad survives several attempts on his life, but eventually two of his bodyguards betray him and allow him to be attacked by two female assassins, a Dragaeran and an Easterner. Vlad's lieutenant had received timely warning of the attack and sent word to Vlad's friends, Morrolan and Aliera, who teleport to the scene. They kill the assassins but are unable to rescue Vlad, who is killed by the Easterner assassin. Aliera revivifies Vlad as well as the two assassins. Vlad meets the Easterner assassin, Cawti, and the two quickly fall in love. Aliera discovers that Cawti's partner, Norathar, is the former heir of House Dragon, having fallen into disgrace as a bastard some time ago. The current heir, Aliera, is looking for a way out of the position, and does a genetic test to determine the legitimacy of Norathar's claim. Vlad turns his attention back to his ongoing turf war, now with the help of Cawti. After yet another failed assassination attempt, Vlad begins to suspect that his war with Laris is only a ruse for some larger plot. After Norathar is confirmed as the legitimate heir, Vlad reasons out that the genetic test that incorrectly dubbed her a bastard was part of a plot to keep her from the throne. Further investigation suggests that Vlad's whole war with Laris has been orchestrated to get Norathar killed and to discredit Morrolan and Aliera. Vlad quickly reasons out that the Sorceress in Green, a prominent Yendi, has been working in consort with Sethra the Younger, an ambitious Dragonlord, to put a Dragon heir on the throne who will appoint Sethra as Warlord. Sethra wants to invade the Eastern Kingdoms and needs to install a sympathetic Emperor to achieve her ambitions. Sethra's namesake, Sethra Lavode, learns of her former apprentice's plans and teleports her away to deal with her personally. Morrolan, Aliera, Vlad, Cawti, and Norathar all pursue the Sorceress in Green, who leads them into a trap. Morrolan, Aliera, and Norathar fight through the Sorceress's thirty guards and magical defenses while Vlad and Cawti watch. Once most of the guards are slain, Vlad sneaks behind the Sorceress, destroys her magical wards with Spellbreaker, and threatens to kill her with a Morganti dagger if she does not give him Laris's location. She complies without hesitation. Vlad backs away and allows the battle to reach its conclusion, with Norathar killing the Sorceress. Vlad summons his enforcers and storms Laris's office, killing him without difficulty. Later, he learns that Aliera revived the Sorceress, believing that her humiliation was sufficient punishment (and also, they have used a mind probe on her and wrote down all the schemes in which she is involved). Sethra Lavode tells him how she teleported Sethra the Younger to an alternate dimension to do penance. Vlad and Cawti get engaged to be married and visit Vlad's grandfather."
20,Fengshen Yanyi,fantasy," The novel is a romanticised retelling of the overthrow of King Zhou, the last ruler of the Shang Dynasty, by King Wu, who would establish the Zhou Dynasty in place of Shang. The story integrates oral and written tales of many Chinese mythological figures who are involved in the struggle as well. These figures include human heroes, immortals and various spirits (usually represented in avatar form like vixens, and pheasants, and sometimes inanimate objects such as a pipa). Bewitched by his concubine Daji, who is actually a vixen spirit in disguise as a beautiful woman, King Zhou of Shang oppresses his people and persecutes those who oppose him, including his own subjects who dare to speak up to him. King Wu of Zhou, assisted by his strategist Jiang Ziya, rallies an army to overthrow the tyrant and restore peace and order. Throughout the story, battles are waged between the kingdoms of Shang and Zhou, with both sides calling upon various supernatural beings -- deities, immortals, demons, spirits, and humans with magical abilities -- to aid them in the war. Yuanshi Tianzun bestows upon Jiang Ziya the Fengshen Bang, a list that empowers Jiang Ziya to invest the gods of Heaven. The heroes of Zhou and some of their fallen enemies from Shang are eventually endowed with heavenly ranking and essentially elevated to their roles as gods, hence the title of the novel."
21,Magic Lessons,fantasy," When a golem pulls Reason into New York, she calls Danny Galeano, Jay-Tee's eighteen year old brother, for help. Danny allows Reason to say with him while she tries to trace the golem, although her feelings for him grow until she eventually sleeps with him, despite Danny continually says that it is not right. Meanwhile, Jay-Tee nearly dies while running, and Tom is forced to give her some of his magic. Reason, who is 15 finds out that she's pregnant with Danny's baby and the whole concept is greatly welcomed. Reason's mother was pregnant with Reason at 15."
22,Jarka Ruus,fantasy," In the 20 years since the events chronicled in The Voyage of the Jerle Shannara, Grianne Ohmsford has become High Druid, or Ard Rhys, of the new Druid Council, but not without misgivings by many over her former life as the evil Ilse Witch. In a bid for power, a group of Druids led by Shadea a'Ru use unorthodox magic called ""liquid night"" to send Grianne out of the Four Lands and into the Demon-infested world of the Forbidding. Tagwen, Grianne's loyal Dwarf aid, sets out to restore her, seeking the aid of her brother Bek Ohmsford. Finding Bek and his wife Rue Meridian otherwise disposed, Tagwen joins forces with their son Pen, who has a supernatural ability to commune with nature. Advised by the King of the Silver River, they set out in search of the legendary Tanequil tree, which they are told can provide a means to reach Grianne in the Forbidding. They are joined by the elf Ahren Elessedil, now a Druid, and his niece Khyber (heir to the magic Elfstones), as well as the mysteriously empathic Rover girl Cinnaminson, for whom Pen develops strong feelings. Along the way, they are stalked by traitorous Druid minions and their spider-like assassin accomplice, Aphasia Wye. They manage to defeat one of the pursuing Druid airships, but at the cost of Ahren's life and Cinamminson's capture. Meanwhile, Grianne finds the Forbidding to be a dark mirror of the Four Lands. Exploring this horrific land known locally as Jarka Ruus, she encounters an enigmatic and somewhat annoying creature called Weka Dart. After defeating a dragon like creature and knocking Weka Dart out of a tree, she has a frightening encounter with the shade of Brona, the most legendary evil from the Four Lands, and Grianne is captured by a party of Demons."
23,Zahrah the Windseeker,fantasy," In the northern Ooni Kingdom, fear of the unknown runs deep, and children born dada are rumored to have special powers. Thirteen-year-old Zahrah Tsami feels like a normal girl, she grows her own flora computer, has mirrors sewn onto her clothes, and stays clear of the Forbidden Greeny Jungle. But unlike other children in the village of Kirki, Zahrah was born with the telling dadalocks. Only her best friend, Dari, isn’t afraid of her, even when something unusual begins happening—something that definitely makes Zahrah different. The two friends determine to investigate, edging closer and closer to danger. When Dari's life is threatened, Zahrah must face her worst fears alone, including the very thing that makes her different. In this novel, things are not always what they seem: monkeys tell fortunes, plants offer wisdom, and a teenage girl is the only one who stands a chance at saving her best friend's life."
24,Daggerspell,fantasy," Events are listed here not in chronological order, but in the order they were originally presented in the novel. ; Year 1045 The sorcerer Nevyn sees an omen indicating that a person whose Wyrd, or destiny, is intertwined with his own has been reborn, and sees the infant Jill in a vision. ; Year 1052 Jill, a seven-year-old girl who sometime has precognitive dreams, loses her mother Seryan to a fever. Because her father, Cullyn, is a mercenary soldier — known as a “silver dagger” for the weapon he carries — and visits irregularly, Jill is taken in by a local tavern owner. Cullyn arrives in Jill’s village a month later. Finding Seryan dead, he decides to take Jill with him on his wanderings, which he calls “the long road.” For seven years, Nevyn has been searching for Jill, with nothing more than luck and intuition to guide him. He finds a clue when he meets the ten-year-old lord Rhodry Maelwaedd, and sees that the boy’s destiny is linked with his and Jill’s. ; Year 643 Galrion, a prince of Deverry, has secretly begun studying dweomer. He begins to fall in love with dweomer power, and out of love with Brangwen of the Falcon clan, his betrothed. Galrion considers breaking his betrothal so that he will have more time to devote to his dweomer studies. Galrion’s father, King Adyroc, is infuriated when he discovers that his son has been studying dweomer, and puts Galrion under house arrest, though the prince escapes by a ruse. Adyroc soon finds his son and sends him into exile, taking from him all his rank, titles, and property. He even takes Galrion’s name from him, and gives him a new name, Nevyn, meaning “no one.” Adyroc also breaks Nevyn’s betrothal to Brangwen, who then falls into an incestuous relationship with her brother Gerraent, and the two promise to end their lives together when autumn comes. When Gerraent’s sworn friend, Blaen of the Boar clan, discovers the incestuous relationship, Gerraent kills him. Gerraent is in turn killed by Blaen's brother. Nevyn takes Brangwen away from the Falcon lands, but the distraught girl drowns herself. Overwhelmed by guilt and grief, Nevyn rashly swears an oath that he will not rest until he sets things right. Thunder booms from a clear sky — the Great Ones have accepted Nevyn’s oath. ; Year 1058 When Jill turns thirteen, Cullyn, who has been teaching his daughter swordcraft, buys Jill a silver dagger like his own for a birthday present. Otho, the smith who made the dagger, notices that Jill can see spirits called Wildfolk, and tells her a riddle. “If you ever find no one (nev yn), ask him what craft to take.” Some time later, Otho tells Nevyn about Jill. Unable to find her, Nevyn returns to his home province of Eldidd, where he saves the life of Rhodry Maelwaedd, earning the gratitude of his mother Lovyan, the local tieryn (an intermediate rank of nobility). Nevyn receives a prophecy about the boy — Rhodry’s destiny is somehow bound to that of the entire province. ; Year 696 Nevyn comes to Deverry province to banish an unnatural drought. Here he finds the bard Gweran (Blaen reborn), his wife Lyssa (Brangwen reborn), and a rider called Tanyc (Gerraent reborn). When Tanyc angers Gweran by his behavior towards Lyssa, Gweran takes his revenge by subterfuge. He provokes Tanyc into attacking him — but as a bard, Gweran’s life is sacrosanct. Tanyc is hanged for his crime. While this is happening, Nevyn meets Lyssa’s elder son, Aderyn. He teaches the boy a little herbcraft, and eventually takes him as his dweomer apprentice. ;Year 1062 Lovyan discovers that Rhodry has fathered a bastard child on a common-born girl, and decides to put the child into fosterage with one of her noble servitors when it is born. In the meantime, Lovyan, is having trouble with some of her vassals. A number of minor lords are sitting on the edge of rebellion over matters of succession and taxes. Lovyan’s own overlord, Rhys, the Gwerbret of Aberwyn (who is also her eldest son), makes it very clear that he won’t intervene unless she disinherits Rhodry. Cullyn, meanwhile has taken a hire guarding a caravan heading toward the kingdom’s western border to trade with the mysterious Westfolk. On the way, Jill sees the errie Loddlaen, a councilor to Lord Corbyn of Bruddlyn. At the trading camp, Jill meets Aderyn, an old Deverrian man who lives with the Westfolk. She also learns that Loddlaen is both half-human/half-Westfolk and a fugitive murderer. At the conclusion of the trading, Aderyn and several of the Westfolk accompany the caravan back to the city of Cannobaen, to begin legal proceedings against Loddlaen in Lovyan’s malover, or court. On the way to Cannobaen, the caravan is attacked by bandits, and flees to an abandoned dun fort to make their stand. Aderyn transforms himself into an owl to spy on the bandits. He discovers that they aren’t bandits at all, but warriors from several different lords, including Corbyn. Cullyn sends Jill to beg the tieryn for aid. By a stroke of luck, Jill comes across Rhodry and his entire warband on the road, in the midst of a day-long training exercise. Meanwhile, the attacking army has reached the dun. The defense is thin: two swordsmen, two archers, and six stavemen. Albaral, a man of the Westfolk, is slain, but the attackers are defeated when Rhodry and his warband arrive."
25,Cats of the Clans,fantasy," In the introductory chapter, ""Three Lost Travelers"", the kits Mosskit, Adderkit and Blossomkit have somehow walked from StarClan to Rock's home under the earth. Rock tells the three that they did not live long enough to learn about their Clanmates. He says he will answer their questions ""about the cats you left behind."" Rock describes himself as ""the keeper of the world beneath the one your former Clanmates walk."" The remainder of the book consists of Rock's stories about each Clan, and various cats (or a group of cats) within the Clan. Rock describes major events in the cat's life, and often comments on why the cat is special or acted as he/she did. There are also stories about a few cats from the Tribe of Rushing Water, SkyClan, and BloodClan in addition to some loners and kittypets. Although Rock, as the narrator, claims neutrality, the book does not treat each Clan equally, devoting more space to ThunderClan cats and being highly critical of one of the other Clans. This is to be expected since readers get to know more of the ThunderClan cats from series than those from the other Clans."
26,The Unwilling Warlord,fantasy," ~Plot outline description~ --> The Kingdom of Semma is on the verge of war but the VIII Hereditary Warlord has died. The King sent out a search party to the Hegemony of Ethshar where with the aid of magic they track down the heir to the title, the Unwilling IX Warlord Sterren. The story evolves as Sterren, along with assorted others hired to help in the war, is hauled off from his career as a low stakes gambler to Semma. One of his companions is Vond, a master Warlock who is feeling the Calling and who is seeking to get as far away from Aldagmor as he can because once a Warlock gives in to the Calling they are drawn to Aldagmor and are never seen again. Vond takes a liking to Sterren who was actually apprenticed as a Warlock for three days before being dismissed as unable to perform. Of course it is against the Guild law for any magician to practice in more than one field so Sterren was disqualified to take up any of the other studies. Not long after arriving in Semma, Vond discovers a second source of power for Warlockry and quickly becomes the most powerful magician in the Small Kingdoms."
27,Keeper,fantasy," After unintentionally ruining a blue moon day by messing up her guardian's crab gumbo and breaking her favorite wooden bowl, causing a friend's ukelele to break, as well as wrecking the plants of her elderly neighbor, Keeper decides to make everything right. Taking with her seven wooden figurines of different mermaids, her dog BD, and a charm she had since she was a girl, Keeper sets out to find her mother, Meggie Marie, who has not been seen in seven years."
28,Ptolemy's Gate,fantasy," The British Empire is falling apart. Many commoners are unhappy with the current government, though none of the commoners claim responsibility for the status quo. The magician's demons are being assaulted by the children's natural abilities to see and resist the demons. (All of the magicians in the government were originally commoners whose parents sold them to the government at a young age, so it is not hard to understand why they are such a heartless group of people, concerned only with power and wealth.) Some commoners advocate slow reform, while others advocate open revolt, while still others say the commoners should learn how to summon spirits of their own to combat those spirits belonging to the magicians. Ptolemy's Gate concludes with a council of surviving magicians and important commoners trying to work out a government that is beneficial to everyone. Kitty Jones eventually unearths the reason why humans and spirits are locked into the endless cycle, that humans do not understand the nature of djinni and summon them only as powerful, but dangerous, slaves, not equals. This theory is confirmed by Bartimaeus who states that his greatest master, Ptolemy, was the only human who treated his servants as equals and tried to build a bridge between djinni and humans. However, Ptolemy misguidedly believed many others would follow in his footsteps; the only other person to ever successfully cross into the Other Place was Kitty. England's domestic turmoil has taken its toll on John Mandrake. Mandrake is friendless and constantly watched by his numerous enemies. In the three years since The Golem's Eye there have been several attempts on Mandrake's life. His years as a high ranking government official have made Mandrake merciless, and he treats all of his servants cruelly, especially Bartimaeus. However, events in Ptolemy's Gate shatter Mandrake's confidence in what he has become. The transformation from Mandrake to Nathaniel is much more rapid than the one from Nathaniel to Mandrake. Nathaniel drops the name John Mandrake all together, as well as the fear of others knowing his true name, humbly telling it to Kitty, with whom he seems to have struck up a newfound friendship, and boldly proclaiming it to the spirit Nouda. With the end of Mandrake, Nathaniel becomes all that Ptolemy hoped to be. Nathaniel willingly allows Bartimaeus to share his body to combat Nouda and his army of hybrids, using Gladstone's staff, a fusion that forever bridges the gap between humans and djinn. However, at the last moment, he dismisses Bartimaeus and then sacrifices himself to destroy the spirit Nouda. This incident was similar to what Ptolemy did in the moments before he died."
29,The Roots of the Mountains,fantasy," The story is set in the Burgdales, a group of small Germanic settlements in the valleys at the foot of a mountain range, and the neighboring woodlands and pastures. The area is inhabited by the interdependent Dalemen, weavers, smiths, and traders, Woodlanders hunters and carpenters, and Shepherds, respectively. Their society is challenged by disruptions from the outside world in the form of the Sons of the Wolf, the descendants of the Wolfings from the previous novel, and the invading Huns or ""Dusky Men."" The Sons of the Wolf, driven from their original country to the Burgdales by the Huns, continue to resist the invaders as a frontier force guarding their new home. The somewhat troubled integration of the Sons of the Wolf into the society they are protecting is told in the story of five lovers representing both peoples, four of whom eventually marry. Morris projected a sequel to The Roots of the Mountains to be called The Story of Desiderius, which was never completed."
